{
  "$schema": "spotfire-source-map.schema.json",
  "schema_version": 1,
  "connectionId": "00000000-0000-0000-0000-000000000000",
  "database": "ANALYTICS",
  "schema": "SPOTFIRE",
  "tables": {
    "table:sales": {
      "table": "SALES"
    },
    "table:customers": {
      "path": [
        "ANALYTICS",
        "SPOTFIRE",
        "CUSTOMERS"
      ]
    }
  }
}
